"CF_PR","UP_CF1","UP_CF2","UP_CF3","UP_CF4","UP_CF5","DW_CF1","DW_CF2","DW_CF3","DW_CF4","DW_CF5","WT1","CTR_IF1","CTR_TH1","CTR_IF2","CTR_TH2","CTR_IF3","CTR_TH3","CTR_IF4","CTR_TH4","CRT_IF5","CTR_TH5","PANAS_1","PANAS_2","PANAS_3","PANAS_4","PANAS_5","PANAS_6","PANAS_7","PANAS_8","PANAS_9","PANAS_10","PANAS_11","PANAS_12","PANAS_13","PANAS_14","PANAS_15","PANAS_16","PANAS_17","PANAS_18","PANAS_19","PANAS_20","GAF_Q1","Regret","Guilt","Shame","Comments","Gender","Age","Race","Ethnicity","Origin","Education","Marital","Live","Spirituality","Upward_Participants","Downward_Participants","Control_Participants","UP_Coun_Num","DOWN_Coun_Num","Participants","Count_Num","CF_1","CF_2","CF_3","CF_4","CF_5","CF_1_Tot","CF_2_Tot","CF_3_Tot","CF_4_Tot","CF_5_Tot","CF_Tot","CF_Tot_All","Postitive_Affect","Negative_Affect"
"I have a habit of making impulsive decisions which most recently has lead to me missing a lot of class. I usually end up feeling guilty about it afterword and I also feel bad apologizing to my professors, not to mention the academic consequences of missing class.","","","","","","","","","","","On a normal weekday, i'll wake up around 10:30 and get ready for class. I go to class, sit in Benson for about an hour depending on my schedule for the day, and then go to my next class, sometimes taking a nap depending on my time/energy levels. I'll finish my classes and usually spend the earlier half of the afternoon doing extracurricular things, working, or taking a nap. I will then sometimes eat food, or continue to the library and eat on my way back. Once I get back to my room it will be anywhere from 10 to 1, and I will take a shower and finish up any work I have left, and then go to bed.",NA,NA,NA,NA,NA,NA,NA,NA,NA,NA,2,3,1,2,2,4,3,3,1,1,3,3,4,1,2,1,2,3,2,3,"Pretty bummed but a little hopeful because the school year is ending soon",5,6,5,"","Male","20","White",2,"USA",2,2,2,3,0,0,1,0,0,"3",0,NA,NA,NA,NA,NA,NA,NA,NA,NA,NA,NA,NA,16,30
"The last time I had a negative experience was when my dog, Gracie, died. I found out when I came back home for spring break. Turns out whe got bitten by soemthing (we think a snake) and fell into the pool. It was really emotional for me because we'd had her since I was in the fifth grade.","","","","","","","","","","","I wake up, go to my first class of the day, get something to eat, then I go to my afternoon classes. After afternoon classes I usually have some sort of club event or professional event I need to attend. I then get a snack it and then head to the gym. After the gym I get something to eat, then shower and start my homework. I then listen to some music or watch tv before going to bed.",NA,NA,NA,NA,NA,NA,NA,NA,NA,NA,3,3,4,1,4,1,1,1,2,3,2,2,1,2,2,4,3,4,3,1,"It is what it is.",1,4,1,"no","Male","19","Black",1,"United States",2,2,1,4,0,0,1,0,0,"3",0,NA,NA,NA,NA,NA,NA,NA,NA,NA,NA,NA,NA,30,17
"Not friends anymore","If we were friendly, we would still be friends","","","","","","","","","","I wake up and brush my teeth. Sometimes I shower, depends on the day whether I shower morning or night. I then go and grab some coffee before class. Usually an iced vanilla latte from Camino. Then off to class. First up is sociology, then econ, then writing on Tuesday and Thursdays. For MWF, I have Gov and Psychology. Once class is over, I love to go walking, This is either at 2 or 4 depending on the day and if my friends are free I go with them or just chat on the phone with my friends or family. I'll also get a salad usually from Forest Greens if I am hungry. Once my walk is over, I meet my friends for dinner at the pit, then we head to the fire-pits to work some more and chat, plus watch the baseball game if it's on. Then I go back to my room when it's dark, and talk with my roommate who gets back at around the same time. We talk for awhile then head to bed around midnight.",7,8,8,8,NA,NA,NA,NA,NA,NA,3,2,3,3,3,2,2,2,3,3,3,3,2,3,3,3,3,3,3,3,"n/a",2,3,2,"n/a","Female","19","white",2,"US",1,2,2,4,1,0,0,1,0,"1",1,56,64,NA,NA,NA,56,64,NA,NA,NA,NA,NA,30,25
"","","","","","","","","","","","",7,8,3,8,3,8,7,8,3,3,2,3,3,4,4,3,3,3,3,3,2,4,3,3,4,3,4,4,3,4,"",3,4,5,"","Male","19","Black",2,"US",1,2,1,4,0,1,0,0,0,"2",0,56,24,24,56,9,Inf,Inf,Inf,Inf,Inf,154,30.8,32,33
"Flying on planes is typically a negative experience for me. Being a lot taller than most passengers, flying comes with several challenges that are rather inconvenient for me. The biggest problem comes with leg space. My knees are typically mashed into the seat in front of me leaving me with next to no mobility. This is only amplified when the person in from of me tries to put their seat back.","","","","","","If I would have gotten an upgraded seat, I would have had more leg space.","If I would have driven to my destination, I would not have to deal with the entire flying experience at all.","","","","I typically wake up around 9 am. I start my day with a shower and reviewing some work before leaving. I then try to get to the pit to get some breakfast. I then attend all of my classes. When I get out of classes for the day, I pick up some lunch at benson or go back to the pit. Next, I try to take care of my homework and deal with any meetings or appointments that I may have. When I finish my work, I try to get to the gym to get some exercise. This may consist of lifting or playing some basketball. I then shower again and get some dinner. After dinner, I finish any remaining work and do some studying. Once I am done with my academic responsibilities, I relax with friends, typically watching a show or movie, or playing video games. I finish my day by getting ready for bed and hitting the hay.",8,5,9,5,NA,NA,NA,NA,NA,NA,4,2,3,1,3,1,2,1,4,3,1,3,1,3,2,4,4,2,3,1,"It is something that I have become used to, and although it is not ideal, I am able to make it work.",2,1,1,"N/A","Male","20","White",2,"USA",2,2,2,4,0,1,0,0,2,"2",2,40,45,NA,NA,NA,20,22.5,NA,NA,NA,NA,NA,34,14
"Once I was very rude to one of my friends who I used to call my best friend. It causes a lot of bickering back and forth and caused us to not be friends anymore. It was extremely hard to adjust to because she was someone who I always hung out with every second of the day, and I had to get used to almost her disappearing from my life like we were never friends.","","","","","","","","","","","I wake up around 7 in the morning and will go get breakfast from the pit or chick-fil-a. Then I will normally do practice problems or work for any class that I have that first thing in the morning which is normally at 9 or 9:30 every other day. I will then either have math class, fys, or a break until my 2:00 class which is my last class of the day. This is my psychology class. Then I will go eat if I haven't and then go to the library until about 4:50 then I will head to the gym to work out and then use the massage chairs. Then I come back and shower eat again if I need to or go to the library until it closes or just until I get the things on my list done. Then I come back and either watches a movie or go straight to bed and repeat my day. This is my typical day of the week unless I have a test, then I will make sure to do practice problems during breakfast instead of maybe watching tv or reading my bible for the day.",NA,NA,NA,NA,NA,NA,NA,NA,NA,NA,3,2,3,2,3,1,5,1,3,3,4,5,2,3,4,4,3,4,5,4,"I feel that I wish the situation didn't go that way and we were friends, but it was for the best because we have grown as people just in different ways.",4,3,5,"No, I thought it was very interesting because the questions were kinda all over the place. So I wonder the outcome","Female","19","African American",2,"United States",1,2,2,5,0,0,1,0,0,"3",0,NA,NA,NA,NA,NA,NA,NA,NA,NA,NA,NA,NA,35,29
"I recently was betrayed by a friend after they blackmailed me into going to an event. They knew I didn't want to, but made me anyway. After it happened I discussed with friends how I should handle the situation and thankfully they gave me good advice. My friend apologized and we are now on slightly worse terms but still talk.","If my friend hadn't forced me to go then we would have avoided the negative experience","","","","","","","","","","I wake up, get dressed, shower, grab a quick snack, and brush my teeth. After I head to my classes for the day and grab lunch in between. Once classes are over I will head back to my room and finish up any work I have or studying I need to do. Then I usually hang out with friends depending on the day of the week. Finally, I head back to my room and usually play some video games before brushing my teeth and heading to bed after setting my alarm for the next morning.",8,9,NA,NA,NA,NA,NA,NA,NA,NA,3,4,2,2,3,2,4,2,3,3,3,4,2,2,5,3,3,3,2,4,"I am happy that we still are friends but I am still worried that they may do something similar in the future",2,3,2,"No","Male","18","White",2,"United States",1,2,2,3,1,0,0,1,0,"1",1,72,NA,NA,NA,NA,72,NA,NA,NA,NA,NA,NA,28,31
"I had a fight with a friend about something. I was angry at her for a few days and then eventually talked to her and we made up.","","","","","","if I didn't talk to my friend then I would still be angry at her","if my friend didn't want to talk, I would have been upset","","","","I normally wake up around 8 in the morning. Then I usually go to a workout class for an hour. I come back to my dorm and shower and get ready for class. My class schedule varies but after class I eat lunch and do some work for school. Then I watch a show or take a nap. Then I hang out with my friends and have dinner. Then I do more homework and go to bed around 11:30.",2,9,7,5,NA,NA,NA,NA,NA,NA,5,2,4,2,3,1,1,1,3,4,3,3,1,5,3,4,4,4,4,1,"I am glad that the situation is over and that we solved our problem",2,2,1,"no","female","19","white",2,"United States",1,2,2,4,0,1,0,0,2,"2",2,18,35,NA,NA,NA,9,17.5,NA,NA,NA,NA,NA,39,19
"my lab final was really hard and i don't think i did very well. once it was over i was a little upset, but i've just not been thinking about it until we get our grades back because there is no point and it's over","","","","","","","","","","","i usually wake up around 7 or 8, depending on the amount of homework i have to do. i shower first thing in the morning, which takes me around 45 minutes because i have long curly hair. then i spend about 30 minutes getting dressed, brushing my teeth, doing my makeup, etc. i have a 9:30 most days so i will do work until class starts. i end class around 3 every day, and i usually have a 45 minute to an hour lunch somewhere in between. at 3 i go back to my dorm and get new stuff for my homework. then when it's nice out i go sit outside and do work and talk with friends. i do work until around 7, at which point i go get dinner. once i get dinner, i go back and do work, usually in the library with friends. i do work for as long as i need to, usually finishing between 11 and 2 but averaging around 12:30. i then go and get ready for bed which includes brushing my teeth, getting changed, etc. i spend around half an hour snapping/talking to a guy i have a thing with before i go to bed and sleep around 1 or 1:30 usually.",NA,NA,NA,NA,NA,NA,NA,NA,NA,NA,3,2,1,1,1,1,1,1,1,1,1,3,1,1,2,1,3,2,1,2,"pretty neutral still",2,1,1,"","woman","19","white",2,"USA",1,2,2,1,0,0,1,0,0,"3",0,NA,NA,NA,NA,NA,NA,NA,NA,NA,NA,NA,NA,16,14
"My mom got into a fight and don't talk as much anymore","if I hadn't been stubborn the fight wouldn't have occured","if she tried to think from my point of view then I would be more understanding","if she made a stonger point to show empathy I wouln't have as much resentment","if I had just accepted her point of view we wouldn;t have been bickering","If I didn't call her back then we wouldn't get into a fight","","","","","","Wake up, get dressed, get coffee and eat food, make a schedule for my entire day, check my email, do work before class, go to classes, do more work, go back home and clean up my room, and maybe hang out with friends, go to the gym, eat dinner with friends, maybe have more meetings or work, do homework till really late, get my room ready for the next day, play on my phone, and go to bed. I feel like the order of these events kind of changes based on which classes I have on a particular day- but I have a very set routine for each day and am pretty consistent about it 

",8,8,8,8,8,8,8,8,8,8,2,2,2,2,2,2,2,2,2,2,2,2,1,2,2,2,2,2,2,2,"n/a",3,2,2,"n/a","female","19","white",2,"US",1,2,1,4,1,0,0,5,0,"1",5,64,64,64,64,64,12.8,12.8,12.8,12.8,12.8,320,64,20,19
"One time I lost my entire phone, credit card, ID, basically everything I own that is important
","","","","","","If I had been more careful and knew were my belongings were then I wouldn’t have lost it","If I wasn’t intoxicated then maybe I wouldn’t have left it at the bar I was at.","","","","When I wake up I wash my face and brush my teeth, then I get dressed for the day. Then I go to my first class which is Spanish every day. Then I go to my other classes and somewhere in between I get Starbucks. Then I go for a walk around the reynolda trail and call friends and family. I try to do my homework after classes in the afternoon. Then I go to the pit for dinner with friends. Some days after dinner I have acapella rehearsal, some days I have chapter for my sorority, other days I hang out with friends or my boyfriend. Occasionally on weekends I go out to frat parties.",9,3,4,4,NA,NA,NA,NA,NA,NA,3,3,2,1,3,1,1,3,3,2,1,4,1,2,3,2,3,1,2,1,"Fine but still disappointed in myself cause it cost me a lot of money to replace",6,5,3,"No","Female","18","White",2,"United States",1,2,1,3,0,1,0,0,2,"2",2,27,16,NA,NA,NA,13.5,8,NA,NA,NA,NA,NA,26,16
"I recently got into a big fight with one of my friends from home.
","","","","","","","","","","","I usually wake up at 8:30 and then sit in bed on my phone until about 9. Then I get up and brush my teeth and wash my face. Then I make my bed and get my bag ready for class. Sometimes I go get coffee and do some work if I can. Then I usually have class from about 10 to 3. After class I grab something to eat and go back to room and rest for about an hour. After I rest I try to do some more work until about 5. Some days I go to the gym and do light exercise, but either way I eat dinner and then shower around 7 or 8. Then I wash my face and get into bed and go on my computer or read until about 12 pm and then go to sleep.",NA,NA,NA,NA,NA,NA,NA,NA,NA,NA,3,3,1,2,4,4,2,1,2,2,2,4,1,3,3,4,4,4,3,2,"I think I dealt with it well and took action to avoid further negativity.",1,2,1,"no","Female","19","White",1,"United States",1,2,1,2,0,0,1,0,0,"3",0,NA,NA,NA,NA,NA,NA,NA,NA,NA,NA,NA,NA,30,24
"One time I got a bad grade on a test. It was organic chemistry and I could not stop crying. The outcome of this situation was that I started paying for a tutor to help me pass the class.","If I had studied more, I would have gotten a better grade.","","","","","","","","","","I wake up, shower, and get ready. I do my hair and skincare. I get dressed and leave for class. I go to my classes. I eat lunch and then go to more class. I study after class. I eat dinner and then study some more. I get ready for bed and then go to sleep.",5,9,NA,NA,NA,NA,NA,NA,NA,NA,4,4,4,2,2,2,4,1,2,1,5,2,1,3,5,3,3,4,2,5,"I feel nervous that I will have the same outcome in similar situations.",6,7,6,"","female","18","eden",2,"USA",1,2,2,5,1,0,0,1,0,"1",1,45,NA,NA,NA,NA,45,NA,NA,NA,NA,NA,NA,26,33
"My mother couldn't stayed with her step mother before she passed away because she stayed with me for an extracurricular class, I deeply regret keeping her with me.","If I didn't have that class then she would have made it in time.","If I went to the class by myself then things would have been different.","","","","","","","","","Wake up
Go to first class 930 most of the time
Class finishes at 1045
Go back to dorm
Play games/do work",9,4,9,5,NA,NA,NA,NA,NA,NA,2,3,2,4,3,3,5,2,2,3,4,2,3,2,4,3,3,2,4,4,"Its passed already but I am very sad about the outcome.",7,7,6,"I am sort of confused, but it seem interesting.","Male","19","Asian",2,"China",1,2,2,2,1,0,0,2,0,"1",2,36,45,NA,NA,NA,18,22.5,NA,NA,NA,NA,NA,26,34
"Whenever I go through something negative, I let myself feel the original emotions but then I try to learn from the situation","","","","","","If I would have stayed in the relationship, then he would still be abusing me","","","","","I wake up either at 6:45 or 8:45 depending on the day, I clean my face and brush my teeth, do my hair and my makeup, get dressed and get coffee before class. I go to all my classes and use my breaks between classes to complete work. I get lunch with my friends and we do work together. Sometimes I go to the gym or go sit somewhere else to do work but most of my day is used to doing homework or studying. I stay with my friend Dejanay most of the day and I usually stay with her until I get tired and want to go to bed. Then I go shower, eat dinner and go to bed. I often get my food from Chick Fil A. And before bed, I either watch tv or scroll through TikTok until I force myself to go to sleep.",9,4,3,3,3,3,3,3,3,3,1,2,1,1,1,1,1,1,1,1,4,1,1,1,1,1,1,3,1,1,"I dont like talking about it but its a teaching lesson",2,1,3,"n/a","f","18","black",2,"usa",1,2,3,2,0,1,0,0,1,"2",1,36,9,9,9,9,36,9,9,9,9,45,9,10,16
"One time I got a really bad grade on a test that I thought was going to go well. After getting the bad grade I felt really bad about myself and was disappointed that I didn't do as well as I should have.","","","","","","","","","","","First I wake up and get on my phone and scroll through tiktok. After that I start getting up and get ready to start my day by getting dressed and maybe eating breakfast. After getting ready I then go to class, and after 1 or 2 of my classes are done I go somewhere to eat breakfast if I didn't eat it earlier and I get some work done. After that I finish my classes for the day and then I take a nap. After taking a nap I go eat lunch and then get some more work done. After I am done with work for the day I hang our with my friends or go to the gym. Once I am ready to go to sleep I then get ready for bed by taking a shower and putting on pajamas. I then watch netflix to wind down and go to sleep.",NA,NA,NA,NA,NA,NA,NA,NA,NA,NA,2,1,2,1,1,1,1,1,1,1,1,3,1,1,1,1,2,2,2,1,"I feel stupid that I felt that way because in the long run it really doesn't matter but at the time it felt like a big deal",3,5,3,"n/a","Female","19","African American",2,"United States",1,2,1,4,0,0,1,0,0,"3",0,NA,NA,NA,NA,NA,NA,NA,NA,NA,NA,NA,NA,16,11
"Recently, I was woefully unprepared for a musical performance. I had never felt so bare and uncomfortable during a concert before and it became difficult to play. Afterwards, I felt very poorly.","","","","","","","","","","","Typically I would wake up around 7:30 to shower and get ready for a class, often starting at 9. Most days of the week, I would be in class straight from then until to around 6. Afterward, I would usually get dinner, and maybe something extra to have later that night. I would probably spend an hour or two with friends at this point, before trying to start classwork. For myself, I think I've developed a Celsius dependency this semester, and can't seem to mentally focus without one. I would open this at some point between 11 to maybe 2, at which point I would actually start doing homework, and find myself asleep around 3 to 5. I could catch up on sleep on weekends",NA,NA,NA,NA,NA,NA,NA,NA,NA,NA,2,3,2,1,1,1,1,1,3,2,1,2,1,2,1,2,2,1,2,1,"It was distressing, upsetting, guilt-causing, and shameful",5,3,4,"No","Male","18","Asian",2,"My parents are from the Philippines",1,2,2,2,0,0,1,0,0,"3",0,NA,NA,NA,NA,NA,NA,NA,NA,NA,NA,NA,NA,20,12
"Once I was upset with my friend and said something hurtful. The outcome was hurtful, however it ended in a makeup.","If I did not yell, then it would not have been hurtful","If I wasn't upset, then I would not have yelled","","","","","","","","","I wake up, shower, wash my face, and get ready for class. I usually go to class, then go to lunch with friends afterwards. Often, I have class again, however if I do not, I will hangout in my lounge with my friends and do things like talk or play video games. After my second (or third) class I usually try to be active by doing something like play pickle ball, basketball, or simply workout. After this, I usually eat dinner with friends, and then spend time doing work and hanging out with friends during the night time. When it is time for bed, I usually shower, wash my face, and lay in bed. I put on Modern Family to fall asleep and set my alarm for the following day.",9,9,9,9,NA,NA,NA,NA,NA,NA,3,1,2,NA,1,1,1,1,NA,2,1,1,1,1,1,2,1,1,NA,1,"not great, but not too bad",4,3,4,"No","Male","20","White",1,"USA",2,2,2,4,1,0,0,2,0,"1",2,81,81,NA,NA,NA,40.5,40.5,NA,NA,NA,NA,NA,NA,NA
"I had an infection on the inside of my leg. They had to drain it in a painful procedure, it was not a pleasant experience","","","","","","If I went to student health erlier, it would have been a more pleasant experience","If the doctor used more numming agent, I would have had less pain.","","","","I wake up, usually around 10 am, take a shower, brush my teeth, and get dressed. I normally go to bagel station for a bacon egg and cheese on an everything bagel and chocolate milk for breakfast. Then I drive back home and play a video game or watch a youtube video. Eventually, I go to class by walking into campus. After classes, I come home and rest, maybe even take a nap. Then I go to",4,9,7,8,NA,NA,NA,NA,NA,NA,1,4,1,3,2,1,1,1,1,2,2,2,1,1,3,2,2,4,2,1,"",1,1,1,"","Male","22","White",2,"USA",4,2,1,4,0,1,0,0,2,"2",2,36,56,NA,NA,NA,18,28,NA,NA,NA,NA,NA,16,21
"Once I was really selfish to a friend and it helped me reflect on myself","","","","","","","","","","","Wake up, attend my classes throughout the day, eat around 11, stop and do some work for a bit, relax/take some time with friends, go on to do some more work. Then go to bed around 12.",NA,NA,NA,NA,NA,NA,NA,NA,NA,NA,3,4,3,1,3,1,2,2,3,3,3,3,1,3,3,5,2,3,3,3,"I don’t really feel anything",4,3,3,"","Woman","19","Black",2,"Jamaica",1,2,1,5,0,0,1,0,0,"3",0,NA,NA,NA,NA,NA,NA,NA,NA,NA,NA,NA,NA,31,23
"One time I fell off my bike because I wasn't paying attention and hurt my arm","If I was paying attention then I wouldn't have fallen","If I had fallen differently then I wouldn't have hurt my arm","If I hadn't been riding my bike then I wouldn't have gotten hurt","","","","","","","","Eat breakfast, go to class, eat lunch go to afternoon classes, take break, go to library, go to gym, eat dinner, go back to library, go to sleep",3,3,3,3,3,3,3,NA,NA,NA,3,4,3,3,3,1,3,3,3,3,3,2,1,5,3,4,4,3,5,3,"Not too bad",3,2,2,"no","male","20","white",2,"United states",2,2,2,4,1,0,0,3,0,"1",3,9,9,9,NA,NA,3,3,3,NA,NA,NA,NA,35,27
"When I was cheated on by my ex boyfriend. This experience was extremely hurtful and it happened a month prior to me finding out. i would have never found out and would have stayed with him had the girl not reached out.","","","","","","If he would have said that I had cheated to switch the story, instead he was honest with people and I respect that","If he would have never admitted to doing it, he was honest to be after trying to hide it for a bit but eventually came around to telling me","If I had not handled the situation with grace and maturity","If I had witness it happen","If it had been with my friend","Everyday I wake up at 9 am, I sit up in bed and check my phone to text my boyfriend good morning as well as check on if anyone had texted me. Then i take a sip of water and take my medication. I then get out of med turn the air conditioning down because im normally cold when Im up and then I go to the bathroom. Then I come back into the room brush my teeth, wash my face, apply my moisturizing products, and my eye cream and then I brush my heart put on and outfit and normally get a croissant and a coffee or tea or a stay in my room and make oatmeal and banana. The my boyfriend will usually call me and I talk with him for a bit to say good morning. Then I will look at my computer and do work if I have it or kind of sit around and wake up and enjoy my morning. Then i have class at 11 which I will walk to and sit in class then I have another class right after that and then another class directly after that one. Then I will normally get an afternoon snack because I haven’t eaten since the morning and I get hungry around this time. Then ill normally call my mom or dad and speak with them for a bit. Then I will ask some friends to hand later or grab dinner later before sitting down to do my homework. Then I will do my homework for a few hours. Then I call my boyfriend after he is out of baseball practice and get dinner and hang with some friends then I get ready for bed after relaxing",9,9,4,4,6,7,2,2,1,1,4,2,5,1,4,1,1,1,5,5,1,3,1,5,1,3,4,1,2,1,"I feel like it was for the best and I don hold grudges I and thankful for the lesson it taughtme and it has made me a more understanding and loving person",1,1,1,"","Female","19","White",2,"USA",1,2,2,5,0,1,0,0,5,"2",5,81,16,42,4,1,16.2,3.2,8.4,0.8,0.2,52,10.4,40,11
