"CF_PR","UP_CF1","UP_CF2","UP_CF3","UP_CF4","UP_CF5","DW_CF1","DW_CF2","DW_CF3","DW_CF4","DW_CF5","WT1","CTR_IF1","CTR_TH1","CTR_IF2","CTR_TH2","CTR_IF3","CTR_TH3","CTR_IF4","CTR_TH4","CRT_IF5","CTR_TH5","PANAS_1","PANAS_2","PANAS_3","PANAS_4","PANAS_5","PANAS_6","PANAS_7","PANAS_8","PANAS_9","PANAS_10","PANAS_11","PANAS_12","PANAS_13","PANAS_14","PANAS_15","PANAS_16","PANAS_17","PANAS_18","PANAS_19","PANAS_20","GAF_Q1","Regret","Guilt","Shame","Comments","Gender","Age","Race","Ethnicity","Origin","Education","Marital","Live","Spirituality","Upward_Participants","Downward_Participants","Control_Participants","UP_Coun_Num","DOWN_Coun_Num","Participants","Count_Num","CF_1","CF_2","CF_3","CF_4","CF_5","CF_1_Tot","CF_2_Tot","CF_3_Tot","CF_4_Tot","CF_5_Tot","CF_Tot","CF_Tot_All","Postitive_Affect","Negative_Affect"
"When I got a bad grade on my test","","","","","","N/A","no comment","","","","So first I wake up. Brush my teeth, shower, wash my face. Then, I put on my clothes and do my morning routine. I then go to to eat breakfast and go to class or the library depending on what day it is. After my classes I eat lunch, workout",3,3,7,8,7,3,8,7,8,8,3,2,3,2,4,2,3,2,3,2,3,2,3,2,3,2,3,2,3,2,"",1,1,1,"","","","",NA,"",NA,NA,NA,NA,0,1,0,0,0,"2",0,9,56,21,56,64,Inf,Inf,Inf,Inf,Inf,261,52.2,27,24
"Once I got yelled at buy a guy that I accidentally stole a parking spot from. I did not mean to steal his parking spot. In hindsight, I realized he was backing into the spot and not driving out of the parking lot. It was a very small parking lot and very confusing and he was very far from the spot. After I parked and got out of my car, he yelled at me “At least park well if you’re gonna steal my parking spot”. There was a parking spot literally two cars down from me. It was not a big deal. But I stayed silent and walked away. He probably had a bad day or something","","","","","","","","","","","First I wake up, check my phone, brush my teeth, put on clothes and all that morning stuff. I have oatmeal or something quick for breakfast. Then I go to statistics. After statistics I got to HES. Then, I work out. After working out I go back to my dorm, shower, change, and go get lunch with my friends and do work. After that, I either have a little break, do work, or go to meetings. Then, I go to my FYS class. After that I normally have a meeting or something else to do. Then I get dinner and then I might go to RUF or younglife or something else like chapter depending on what day it is. I normally finish all my homework on Sunday so I might study or finish something else up. Then I might watch tv if I have time and have a snack then get ready for bed and go to sleep.",NA,NA,NA,NA,NA,NA,NA,NA,NA,NA,2,2,1,1,3,1,1,1,2,1,2,2,1,2,1,3,4,5,2,1,"I feel like I should’ve stood up for myself. I also hope that guy is having a better day than he was that day.",1,1,1,"No","Female","18","White",2,"US",1,2,2,5,0,0,1,0,0,"3",0,NA,NA,NA,NA,NA,NA,NA,NA,NA,NA,NA,NA,22,16
"One time I had a falling out with a friend because she did not help with an important academic group project. I had reminded her many times and tried to find her on campus but could not. She ghosted me. I was pretty upset because it caused our grade to not be great. She didn't contact me for two months (partially during Winter Break). A couple days before the Spring semester she sends a text explaining herself and hoping we could be friends, though she didn't apologize in the text. We are friends now, but not as close as before.","If she had apologized in the text, then I would have been more forgiving and we would be closer friends.","If she had not ghosted me, then we would have done better on the assignment and not had the friend falling out.","If I had not asked her to be in a group project together, then we could separate friendship and academics more.","If I had given her a final deadline to complete her part of the project that was well in advance, then I could have known she wouldn't have done it and I would do the whole project.","If I had gone to the professor about it, then he may have been more lenient about grading.","","","","","","I wake up at 9am on most days. I put on an outfit and get ready in the bathroom. I go to my first class, gen chem II. At 10:45 I go to the pit and eat food with a friend. At 11:30 I take the shuttle to Wake Downtown. I work on homework there or look at the biochem lecture before class. At 12:45 I have biochem class. At 2pm I take the shuttle back to campus. I do some assignments or sit outside until 3:30, when I have my women gender studies class. Then I either have chemistry lab until 9pm or I go eat food and go to the library to do more homework. At around midnight I go to my dorm and hang out with my roommate and suitemate, then shower and go to sleep. Other days I go to volunteer for a couple hours, but that is not everyday.",6,9,8,4,7,4,2,4,9,2,4,4,2,4,2,4,3,1,3,2,4,3,4,2,5,4,3,4,3,3,"I don't feel good about it.",2,2,2,"None","Female","19","White and Asian",2,"USA",2,2,2,2,1,0,0,5,0,"1",5,54,32,28,8,18,10.8,6.4,5.6,1.6,3.6,80,16,28,36
"A significant other told me things weren't going to work out for a number of reasons, most of them made up. Not only that, we hadn't talked in several weeks and it was in public. I had an idea it was going to happen, and it happened before a break from school, but she brought it out when we returned from break. I was extremely angry and sad at the same time, I couldn't focus schoolwork and had to walk around campus for a while and call a friend to sort myself out.","","","","","","If I hadn't stood up for myself in the moment, then I would've felt regret at the fact that I could've stood up to her.","If I wouldn't have texted her over the break, then this whole ordeal wouldn't have happened","If she had made it more clear we were finished before break, then I would've spent break trying to get myself back together rather than thinking about her","If I would've ignored her invitation, I would've felt much less stress, anger, and confusion","","I wake up before my class, grab food that I have leftover for breakfast, get dressed and walk to class. Most days, I have two classes in a row, so I go to those and then go to the Pit to have lunch with some of my friends around 11. Then, I go back to my room and get started on homework, play video games, or do laundry. I go to the gym before late afternoon, then return to my room to get more homework done. Around 6, I go get dinner with some of the guys in my fraternity and chill with them for a bit. After that, I either play video games or watch any sports that are on, specifically hockey or basketball. This typically lasts until I shower at night and go to bed. If not, I spend time with my girlfriend until I decide to shower or until she kicks me out.",2,4,7,4,6,5,1,4,3,3,3,1,1,1,2,1,1,1,2,3,3,4,1,2,2,3,3,2,2,1,"Still pretty annoyed, but not unhappy or anything. I'm not dwelling on it much",3,5,4,"It was interesting how experience was interspersed with examination of a general day in the life to take emotional charge out of the negative situation.","Male","19","White",2,"United States",1,2,2,4,0,1,0,0,4,"2",4,8,28,30,4,9,2,7,7.5,1,2.25,56,11.2,25,14
"I found out that someone I knew said something hurtful about me.  This caused me to lose trust in the person, and also briefly resent them.  I am not very close with this person, so I did not feel that it was necessary to talk to them about it.","If I had talked to him, then our relationship could of been stronger.","If he was a nicer person, he then likely would not have said something hurtful.","If I didn't find out, I would of then thought of him in a better light.","If I held a grudge, then our relationship would be worse, and I would feel worse.","If I break people's trust, then other people will feel what I felt.","","","","","","I usually wake up early since I have a 9 am class most days of the week.  Between my first and my second class, I chill in my room or work on HW depending on how tired I am or much work I have.  After my second class usually around noon, I grab lunch with friends.  After my last class at 2, I usually work on chores like cleaning the room or laundry, or finish my homework.  If I have time, I like to play basketball or go to the gym during this time as well.  I usually eat dinner with members of my fraternity at 6, and after that, I finish up HW if I still have some, or hang out with my roommates in our room.  I usually go to bed around 12 or 1.",8,9,4,5,9,9,5,5,5,5,3,2,2,1,3,1,1,1,2,2,1,2,1,2,1,3,4,1,3,1,"I feel better being able to reflect on it.",3,1,1,"When I say regret, I specifically don't regret my actins, but instead lack thereof.","Male","30","Caucasian",2,"USA",1,2,1,2,1,0,0,5,0,"1",5,72,20,81,25,25,14.4,4,16.2,5,5,181,36.2,26,11
"Recently, my relationship of many years ended. He was my best friend before we started dating and we promised each other that if we ever broke up, we would try our best to work our way back to being best friends. We broke up before college started for us but ended up falling back into old patterns of communication and interactions. We decided to continue an emotional involvement in the most ambiguous way which was annoying to me but we loved each other and I thought that he was the one for me. Then, this semester started and things went downhill. He ghosted me for weeks and then we eventually talked and ended things for good. We have been trying our best to talk a little bit once in a while because restoring our friendship is a priority for us both, but I've been feeling extremely weird about talking to him knowing that he's doing things with other girls. It's getting too much for me to handle and I find myself shutting down.","","","","","","","","","","","Wake up, go to the bathroom to brush my teeth, shower, etc, come back and make a cup of tea, get back into bed for a bit, and wake up properly, I do my skincare, next is makeup, I choose an outfit, get dressed, pack my bag for the day, head to class, classes last till the afternoon, get food, eat with someone, go back to my room, watch some Netflix, do homework, study for tests/exams, change my clothes to something comfy, go get dinner, come back to my dorm, watch my show, talk to my parents, set my alarm for the next day, enable sleep mode, arrange my pillows, play my sleep sound playlist and then I fall asleep.",NA,NA,NA,NA,NA,NA,NA,NA,NA,NA,4,2,1,3,3,1,3,1,1,1,2,1,1,1,4,1,1,2,1,1,"i feel sad and self aware. It's not unbearable but it's still pretty awful...",2,1,1,"no","female","20","brown/indian",2,"india",2,2,1,3,0,0,1,0,0,"3",0,NA,NA,NA,NA,NA,NA,NA,NA,NA,NA,NA,NA,15,20
"I recently got into a fight with a friend, as I expressed issues with a certain individual that he was quite close with. It was a pretty unproductive argument, however the outcome was positive, as we resolved that we are each entitled to our own opinions and that I should make an effort to resolve my issues with that certain individual.","","","","","","","","","","","-Wake up at 8:30am 
-Shower, shave, brush teeth, get dressed 
-Get quick breakfast at 9:30am
-Attend classes from 10am-12pm
-12:15pm go to lunch for about 30 minutes 
-1:00pm relax for about an hour / take nap if needed 
-2:00/2:30pm go to gym for an hour 
-3:30/4:00pm Go back to dorm, snack and shower
-5:00pm Do schoolwork
-6:00pm Dinner 
6:30pm-8:30/9:30pm finish schoolwork 
10:00pm - relax and hang out with friends
12:00am-12:30am- go to bed",NA,NA,NA,NA,NA,NA,NA,NA,NA,NA,4,3,4,1,4,2,3,1,4,4,2,3,1,3,4,4,3,2,4,2,"I feel like it was productive and likely the best way it could've ended up",3,3,2,"","Male","20","White",2,"Bermuda",2,2,2,4,0,0,1,0,0,"3",0,NA,NA,NA,NA,NA,NA,NA,NA,NA,NA,NA,NA,37,21
"The outcome was a loss in low quality friends.","If I did not react negatively I would still be friends with 2 girls.","If I ignored the situation I would be subconsciously angry at the girl.","If I forgave the girl everything would remain the same.","If I was angry for a week instead of cutting someone off then we would still be friends but with a break.","If I did not care then I would not have as much self-respect.","","","","","","When I wake up I get ready by brushing my teeth, picking out an outfit, doing makeup and other hygiene tasks. Then I go to class and maybe get lunch in between if not after all my classes. Then I either take a nap, watch Netflix, or workout. Once a week I pick up groceries so if I hadnt gone grocery shopping I would do it at this point in the day. After I will do any homework and pick up dinner. Sometimes I will hangout with friends and watch a show or movie together. Once all my work is complete I will shower and get ready for bed. Then I will watch a movie or TV until I fall asleep.",2,2,2,9,2,2,7,7,1,1,1,1,2,2,1,1,1,1,1,1,2,1,1,1,1,2,3,1,1,1,"Not interested and motivated for that outcome to occur.",1,1,1,"","Female","19","White",2,"U.S.",1,2,2,1,1,0,0,5,0,"1",5,4,18,4,49,1,0.8,3.6,0.8,9.8,0.2,104,20.8,14,12
"My friends were all upset recently because we all had a big decision to make that could break out friend group apart a little bit.","","","","","","If everyone would have made a decision together, no one would have been upset","If everyone talked about their feelings about the situation, everyone would have been more understanding","","","","I wake up around 9:00am and then get up, wash my face, brush my teeth, brush my hair, and get dressed. I then will sit on my phone until it is time to go to class. I then have classes until either 12:15 or 12:50 depending on the day. After all of my classes are done, I will get food with some friends. We all come back to the dorm and work on some homework. Sometimes we will go to the roof or balcony of our dorm building to do work if it is nice out. We then will all get dinner together. After that, we will continue doing homework and then just hangout until we are all tired and go to bed.",4,4,4,4,NA,NA,NA,NA,NA,NA,4,2,4,1,4,1,1,1,4,4,1,3,1,3,1,4,3,2,NA,1,"We all worked it out a no one is upset anymore so I feel good",3,3,3,"","female","18","white",2,"america",1,3,2,5,0,1,0,0,2,"2",2,16,16,NA,NA,NA,8,8,NA,NA,NA,NA,NA,NA,12
"I accidentally lost my roommate's charger. I was scared to tell her until she asked for it back. She got really angry at first, but then she calmed down as i offered to get her a new one. A friend had an extra she gave and my roommate tried to mess with me and pretend she was still mad.","","","","","","","","","","","My alarm goes off twice before I wake up, then I roll out of bed and get dressed, brush my teeth, look into my suitemates' rooms to see if they're awake, and get my backpack to go to class. I typically go to class then after I stop by Shortys to see if any of my friends are sitting outside. If a friend wants to go to the pit I will. If the shaded table by the outlets outside shortys is open I'll sit there to do work, otherwise Ill walk back to my room and try and find a shaded spot outside to do my work until I have another class. Typically someone will sit with me and we'll chat and talk to anyone we know who walks by. After class I often grab an early pit dinner before it gets crowded. Then I come back home, do some more work until I have an obligation or get really tired. If its not a busy week I'll stop my homework around 8 and watch tv with my friends until I go to sleep. My roommate gets home really late and we do a debrief before I fall asleep typically.",NA,NA,NA,NA,NA,NA,NA,NA,NA,NA,2,1,1,1,2,2,1,1,1,1,2,1,1,1,2,2,2,3,1,1,"I feel good about it.",7,5,2,"","female","21","white",2,"US",3,2,2,4,0,0,1,0,0,"3",0,NA,NA,NA,NA,NA,NA,NA,NA,NA,NA,NA,NA,14,15
"I remember being at a conference meeting and feeling very out of place. The feeling made me physically upset my stomach was turning and I felt like I was going to throw up. I found myself looking for support or reassurance. It made me think about how I often got this feeling here at Wake. Being the only woman of color in some of my classes and feeling the heftiness that my answers carried in class discussions. It made me realize how heavy the atmosphere felt and what my place was in the classroom.","","","","","","If I speak up will I be considered a ""disruption in class"" and have no one listen to my answer","If I stay quiet will I viewed as someone who doesn't understand the material","If I speak up and give a ""wrong"" answer will I be labeled as someone that doesn't belong here","If I stay quiet- how does this shift the way people view women of color","","I wake up and turn off my alarms as I usually have more than one to make sure my suitemates aren't awakened by the noise.
I go to the shared bathroom and brush my teeth and take my cup with my toothbrush and tongue scrapper and toothpaste 
I then use the bathroom if i nee
",9,8,4,9,9,3,8,7,3,3,2,4,3,4,2,5,4,4,2,3,4,4,5,3,4,2,3,4,2,4,"I feel overwhelmed by it sometimes and don't know if it is something I should be talking about alone",5,5,5,"Maybe a little bit more time for the everyday tasks list haha","Female","20","Latina",1,"United States",2,2,3,4,0,1,0,0,4,"2",4,72,36,27,56,9,18,9,6.75,14,2.25,157,31.4,26,42
"My ex boyfriend asked to get back together recently and I said no which caused a huge fight and a really stressful outcome from my response.","if I said yes then he would've been kinder to me","if I said no to now but yes to being together in future, then maybe our fight wouldn't of been that big","","","","","","","","","On a typical school day, I wake up, get dressed quickly, and head to class. I usually have two morning classes back to back so I will go to those. Then I will meet my friend for lunch and study for two hours until my afternoon class. Once that class is finished, I will probably go to the library to study more. Then I will meet friends for dinner and to relax for a bit. I will go to the library at night for a few more hours to do work. Then I will come back to my room, get dressed for bed and text/call friends. I will probably then watch something or scroll through social media until I fall asleep.",2,5,7,9,3,3,3,3,3,3,3,1,1,3,1,1,1,1,1,1,2,2,1,1,1,2,2,3,1,1,"sad",1,2,1,"","female","19","white",2,"Canada",1,2,1,4,1,0,0,2,0,"1",2,10,63,9,9,9,5,31.5,4.5,4.5,4.5,45,9,15,15
"A recent negative experience that I had was that a couple people in my roommate group left at 1am the day of housing registration without telling us. This meant that we not only would not be able to live in one of the 6 people rooms we had wanted to live in but that we also got stuck with a much later registration time. Because of this, we got stuck living somewhere unideal and with random people we didn't know as well. Subsequently, the friendship between those who left the roommate group and the rest of us has deteriorated and we no longer hang out with them because we do not respect or trust them.","","","","","","","","","","","First I wake up, brush my teeth, get dressed, and leave for class. I usually grab lunch at the pit at some point with a couple of friends and then after class, I usually go to the gym. Then I usually go to the pit around 4:30 after I work out with a few friends, after which we hang out, play video games, watch TV, smoke, etc. Then I usually sit down for a while in my room and get my homework done. After this, I grab dinner at Benson or Subway with friends or alone. Then I get back to my dorm and hang out with my friends some more before I head back to my room to watch a little TV before I shower and then go to bed.",NA,NA,NA,NA,NA,NA,NA,NA,NA,NA,3,3,2,2,4,2,1,1,3,3,2,3,2,2,2,2,3,3,5,1,"Not very good",1,1,1,"None","Male","18","White",2,"USA",1,2,1,3,0,0,1,0,0,"3",0,NA,NA,NA,NA,NA,NA,NA,NA,NA,NA,NA,NA,30,19
"I recently was rejected from a summer opportunity. The outcome was positive because it pushed me towards another opportunity that i think will be better for me and pushed me to fully embrace it without worrying about turning something down and missing out.","if i would have gotten in, i would have had more options","if i had more options, i would have struggled with indecision and making the wrong choice","if i had known my interview experience wasnt as positive as i thought it was, i would have lowered my expectations","if i had chosen that program instead, i would have let people down who were relying on me","na","","","","","","i wake up at 645 and immediately get up and get ready. at 7am i leave my suite and walk to farrel, where i get an einsteins bacon egg and cheese three days a week. i sit and eat and drink my coffee and do work/check the internet until 745. then i go to my 8 am class, which i have every day. then i go to my 10 am class, then i have another class depending on the day and am typically done by noon. i either get lunch with friends or go downtown to grab lunch at wake downtown before research. sometimes i volunteer in the afternoon. i spend my free time doing homework. i go run for an hour and a half most afternoons. by 8pm i am tired and start to wind down. i watch tv or youtube or browse the internet. then around 10pm i am exhausted and go to bed.",9,5,9,9,3,4,8,4,3,3,3,1,3,1,3,1,1,1,3,3,2,2,1,1,1,2,2,3,3,1,"not concerned",1,1,1,"no","female","19","white",2,"us",2,2,1,3,1,0,0,4,0,"1",4,45,81,12,32,9,11.25,20.25,3,8,2.25,94,18.8,25,13
"I was mean to a friend and i lost that friend","","","","","","I was mean to my friend and lost her but if i was nicer i would still have that friend","","","","","I get to sleep in every day until 11 am. Then I go to class at 12, eat lunch and either relax or go to the gym. Then shower and dinner. After dinner, I do homework and eat dessert. Then I will go back to my room, relax, and go to bed. I like watching tv before bed. I also pick out my clothes for the next day before then I basically wake up and do it all over again.",8,7,3,8,3,3,3,3,3,3,4,4,4,2,3,1,1,2,4,4,3,3,2,3,3,3,2,3,4,2,"",2,2,3,"","female","19","white",2,"usa",1,2,2,3,0,1,0,0,1,"2",1,56,24,9,9,9,56,24,9,9,9,45,9,34,23
"One of my friend continues to make comments on people's physical appearance and it's really bothering me. He just continues to make note of certain physical imperfections on people. A lot of these qualities are things that don't matter and also cannot be controlled. I really want to say something to him but I'm also worried it might hurt the friendship. At the same time, I feel like it's already hurting the friendship and if I say something it could only help. This is just a bit of a dilemma I'm having.","","","","","","","","","","","I wake up and get dressed. Sometimes I have to mess with my hair because it's getting really long too. Then I go to whatever my first class is, or work if it's Thursday. After classes, I'll go one of three places: to get food, to the library to study or to my room to chill. After I'm done with classes and work for the day, I like to play basketball with my friends or go to the gym on some occasions. Then, I'll grab dinner with one of my friends. Later, it's time to do homework and prepare for classes tomorrow. If I'm lucky, there is usually an hour left in my day to spend just talking to my friends or watching a show. I'm usually in bed before 2:00 am after showering and brushing my teeth.",NA,NA,NA,NA,NA,NA,NA,NA,NA,NA,1,2,2,3,2,3,4,4,3,2,4,4,2,3,3,4,2,1,3,4,"The same as before. I'm not sure anything is going to change.",3,2,1,"no","Male","19","White",2,"United States of America",1,2,2,1,0,0,1,0,0,"3",0,NA,NA,NA,NA,NA,NA,NA,NA,NA,NA,NA,NA,26,30
"I got frustrated with my friend because he wasn't respecting my boundaries. I got angry at him and we stopped talking for bit, but then I forgave him and he continued to disrespect my boundaries but to a lesser extent","I could have said nothing and the boundaries could have continued to be pushed","I could have continued to be angry, and we wouldn't be talking","I could have talked to him in a more respectful manner about my discomfort and he would have stopped all together","","","","","","","","I wake up and go on my phone for a bit. I then get out of bed and eat a snack, brush my teeth, fix myself up and leave. I then either go to class or research for a while. I then eat lunch and either do some work or go to class. I then will usually go to practice and then eat dinner. I will then shower and get some work done. Then I will either watch tv with my suitemate, play video games, or go on my phone until I go to bed, where I usually will listen to a video and fall asleep.",2,4,2,2,6,8,3,3,3,3,3,2,1,1,5,1,1,2,2,4,2,1,1,1,1,1,1,1,1,1,"Pretty neutral right now",1,1,1,"","Male","21","White",2,"USA",3,2,2,2,1,0,0,3,0,"1",3,8,4,48,9,9,2.66666666666667,1.33333333333333,16,3,3,84,16.8,20,13
