"CF_PR","UP_CF1","UP_CF2","UP_CF3","UP_CF4","UP_CF5","DW_CF1","DW_CF2","DW_CF3","DW_CF4","DW_CF5","WT1","CTR_IF1","CTR_TH1","CTR_IF2","CTR_TH2","CTR_IF3","CTR_TH3","CTR_IF4","CTR_TH4","CRT_IF5","CTR_TH5","PANAS_1","PANAS_2","PANAS_3","PANAS_4","PANAS_5","PANAS_6","PANAS_7","PANAS_8","PANAS_9","PANAS_10","PANAS_11","PANAS_12","PANAS_13","PANAS_14","PANAS_15","PANAS_16","PANAS_17","PANAS_18","PANAS_19","PANAS_20","GAF_Q1","Regret","Guilt","Shame","Comments","Gender","Age","Race","Ethnicity","Origin","Education","Marital","Live","Spirituality","Upward_Participants","Downward_Participants","Control_Participants","UP_Coun_Num","DOWN_Coun_Num","Participants","Count_Num","CF_1","CF_2","CF_3","CF_4","CF_5","CF_1_Tot","CF_2_Tot","CF_3_Tot","CF_4_Tot","CF_5_Tot","CF_Tot","CF_Tot_All","Postitive_Affect","Negative_Affect"
"One time I was mean to one of my best friends. My friend group very rudely cut her out of our group and we were very awful and exclusive. When time passed and we all grew from the situation, we all apologized to her and started a new.","","","","","","If she would've been refuting the apology, there would have been no resolution.","","","","","Typically, I wake up and take a shower. Then I got to Starbucks and spent money on coffee I just don't have. My favorite part of the day is listening to music on the way to class. It always determines my mood. I go to my classes and after I get lunch or just walk back to my suite. Then I chat and gossip with my suite mates. We usually all either do homework outside or watch a movie/tv show we all lover while doing work on the couch. We then usually go to the north pit and eat a big meal. After that we go back home and do more work separately in our beds. My roommate and I get ready for bed and then we take turns reading a book out loud to each other about love. After that, we get ready for bed and I watch YouTube, arms, or a movie before falling asleep with my AirPods in. Ten minutes later I wake up, put my AirPods away and then go back to sleep for the rest of the night.",9,9,NA,NA,NA,NA,NA,NA,NA,NA,4,4,3,2,3,2,1,1,1,1,2,2,2,2,1,3,3,3,2,1,"I feel fine.",5,5,6,"","female","20","White",2,"USA",2,2,2,5,0,1,0,0,1,"2",1,81,NA,NA,NA,NA,81,NA,NA,NA,NA,NA,NA,24,19
"This past week I have been really stressed out because of school work and planning some things for the future. Sometimes, this has led me to be short with my friends or to want to isolate myself while everyone else is hanging out. When I feel the need the have some time to myself, I usually take that time, and then do something that releases stress. This most often is going on a walk or run. By then it is usually around dinner time, so I can enjoy a meal with my friends. This is what happened a couple of days ago. After my run, even though it was short, I was in a better mood, and I was able to enjoy the meal with my friends.","","","","","","","","","","","I usually wake up to my third alarm after snoozing the first couple. I get out of bed, make my bed, brush my teeth and wash my face in the bathroom. Then I do my skincare or any make up I want to wear for day which is usually just moisturizer, concealer, and mascara. I do this while drinking coffee. I then get dressed and go to my first class of the day. In between classes, I usually come back to my room to get work done and eat a snack. I sometimes just lay back down though or talk with my suite mates. I sometimes also squeeze in a lunch with some friends. Then I go to my last class of the day which ends in the afternoon. I usually do a little bit of homework and eat a snack. Then I do some type of exercise. Right now, I am rotating between running, walking, or hot yoga classes. I try to be working out for at least 45 minutes, but if I am walking I usually walk for an hour and call a family member or a friend from home. When I get back from my workout, I usually eat dinner on campus with my friends. Recently, we have been eating outside on the quad. After dinner, I either do my homework or shower. Then I talk to my suite mates a little more before going to bed. I undo my bed, change into pajamas, brush my teeth, do skincare, and then get in bed. I usually get in bed and either read or watch a little tv.",NA,NA,NA,NA,NA,NA,NA,NA,NA,NA,3,2,3,1,1,1,1,1,1,1,1,2,1,2,2,2,2,1,1,1,"I think I took steps to make the outcome the best it could be and I got to spend time with my friends.",2,3,2,"","female","20","white and asian",2,"United States",2,2,2,5,0,0,1,0,0,"3",0,NA,NA,NA,NA,NA,NA,NA,NA,NA,NA,NA,NA,18,12
"I had a negative experience when I got in a bad fight with my mom about grades. This took a toll on me, but it was eventually resolved. It always stays in my head when I think about negative expereiences with my mom.","i could have lowered my voice","tried to hear my mom out","","","","","","","","","wake up, brush and get ready for school. Go to class then either take a nap or do homework adn then eat lunch. depending on the day I will have work from 3-6pm. Then i go to the gym for about 1hr 30mins and then I eat dinner. After that I shower and chill in my room either hang out with friends or catch up on work. And then I try and get into bed before 12:30-1ish.",7,3,3,8,3,3,3,3,3,3,3,4,4,3,4,2,2,2,3,3,4,3,3,3,4,3,3,3,3,3,"Greatful that it was resolved",4,4,5,"nope","male","18","Asian",2,"United States",1,2,2,3,1,0,0,2,0,"1",2,21,24,9,9,9,10.5,12,4.5,4.5,4.5,45,9,32,30
"","","","","","","","","","","","from the moment I wake up, I usually spend a little time in bed while I completely wake up. During this I usually check any emails or texts I might have received after falling asleep. After this I brush my teeth and change. Then I head out to class. Usually in between classes I will grab something to eat. Depending on the day I may be in a bio or chemistry lab till late in the day, and if this is a day I have a lab I usually eat dinner after leaving lab. I then usually go to zsr to do any homework or assignments that are due before class the next day. I also usually have a test that I have to study for. After being at zsr for a couple of hours I usually go back to my dorm and shower. I then usually will either watch some netflix or scroll on tiktok till I fall asleep sometime around midnight or 1:00 AM.",NA,NA,NA,NA,NA,NA,NA,NA,NA,NA,3,2,2,1,3,1,1,1,4,5,1,3,1,3,1,4,4,1,NA,1,"",1,1,1,"","Male","19","hispanic",1,"United states",1,2,1,3,1,0,0,0,0,"1",0,NA,NA,NA,NA,NA,NA,NA,NA,NA,NA,NA,NA,NA,11
"Last week, I was studying for my test I had the next day when I got a text from my big in my sorority saying “Are you going out to this place tonight? Half the girls in your class are here.” It sent me into a panic because I knew I was doing the right thing to study before my test. But it just amplified my guilt and anxiety about not being a fun or exciting person. As a pre-med student, I take a lot of classes that require me to study a lot more than my peers, which sometimes isolates me from spending time with them, be it going out to dinners or going out at night. I miss out on fun activities, so when I do go, it is more awkward because i feel like i missed everything and i have no clue whats going on.","","","","","","","","","","","I wake up around 9 or 10 (usually right before my first class) and am in class until 1. Sometimes i eat lunch by myself in my room, sometimes i grab lunch with friends, or sometimes i don’t get lunch because i go straight downtown to work at a research lab after classes. I usually get back around 4. Then i will relax in my room and later go get dinner with friends. Around 8 or 9, I’ll start studying and wont go back to the room until 12 or 1. I shower and then usually chat with my roommate about the day. I go to bed around 1 or 2. I have been recently trying to fit in working out, but my schedule gets so busy and i feel so tired during the day that it is difficult.",NA,NA,NA,NA,NA,NA,NA,NA,NA,NA,3,4,2,2,1,2,4,1,2,1,1,2,5,1,5,4,3,1,3,3,"I feel very unsettled about it because it makes me feel like a boring person. I also feel like she is disappointed because we are friends, but her friend (me) is not having a good time like everyone else. It is a bit isolating. I hate the pressure, but i want to be included.",1,6,7,"No. I forgot to mention that i just texted her back saying that i could not go out because i had a test, but i wish i could.","Female","18","Asian",2,"Born in America, but i am Korean",1,2,2,5,0,0,1,0,0,"3",0,NA,NA,NA,NA,NA,NA,NA,NA,NA,NA,NA,NA,22,28
"I had applied to a job and they said they’d get back to me but never did. A week later I went in to ask them what the deal was and they had given the job away and apologized for not reaching out but couldn’t offer me another job.","","","","","","If I would’ve came in angrier then they probably never would’ve wanted to hire me","","","","","I wake up and get ready for class. Then I go to my classes and grab lunch afterwards. Then I usually go back to my room and watch TikTok and then I do homework sometimes. Then I’ll probably grab dinner with friends or Grubhub something. Then I’ll come back do some more work and then watch TikTok until I shower. Once I shower then I get ready for bed and then watch TikTok again until like midnight and then I take melatonin and go to sleep. Sometimes I’ll listen to music when I go to bed.",4,9,4,8,NA,NA,NA,NA,NA,NA,3,2,1,1,2,1,1,1,3,3,3,3,1,3,3,3,3,3,3,1,"I feel fine. Still holding a bit of a grudge but I love their food",1,1,1,"","Female","19","Asian",2,"China",1,2,1,2,0,1,0,0,1,"2",1,36,32,NA,NA,NA,36,32,NA,NA,NA,NA,NA,27,17
"When I had my last negative experience, which was not doing well on a test, I cried, then complained, then accepted it and decided how I will fix it.","If I studied more, then I would have done better on my test.","If I did not sit next to my friend, then I would not have been distracted.","","","","","","","","","I wake up and immediately get ready. Each day I go to Caminos coffee shop in the library and get an iced coffee before my first class. Then, I go to my 930 class, then my 11 am class. After that, I quickly get lunch and another coffee, then go to the library to do any work or studying that I have. Then I go to the gym, shower, and get ready for my next class. Then I go to my 330 class. After that, I relax for a bit, hang out with friends, then get dinner with those friends. After that, I do anything else I have left on my to-do list (such as laundry), then I relax and hang out with my friends again before I go to bed.",5,4,9,9,NA,NA,NA,NA,NA,NA,4,2,5,1,4,1,1,1,5,4,2,3,1,5,1,5,5,2,4,1,"I feel much better, because I know how to fix it.",3,3,2,"","female","18","White",2,"United States",1,2,2,5,1,0,0,2,0,"1",2,20,81,NA,NA,NA,10,40.5,NA,NA,NA,NA,NA,44,13
"I got my teeth knocked on while playing softball. I had to get rushed to the ER and they had to pull my teeth forward. I was able to keep all my teeth, and I recovered well.","","","","","","","","","","","I wake up, go to the bathroom, decide what I am wearing for the rest of the day, make my bed, brush my teeth, do my makeup, pack my backpack, get coffee, head to my first class, pick up breakfast, head to the library or to norht campus depending on the day, work, go to my 1-1:50 class, then go to my 2-2:50 class, grap something to eat, bring it back to the room, watch tik tok while eating, call my mom, do some work, get changed, work out, come back, shower, if its a Monday I go to a chapter meeting, after chapter eat dinner with friends, either go home or to the library, get ready for bed, normally watch tik tok again, talk to my roommate and friends, go to bed.",NA,NA,NA,NA,NA,NA,NA,NA,NA,NA,4,2,4,2,3,1,2,1,4,4,2,3,1,4,3,5,4,3,4,2,"Happy its over, was nervous in the moment.",4,2,1,"na","female","18","white",2,"USA",1,2,2,2,0,0,1,0,0,"3",0,NA,NA,NA,NA,NA,NA,NA,NA,NA,NA,NA,NA,39,19
"I recently lost a friend because of a fight. They didn’t like something I did and decided to talk to someone else about it other than me. I found out through word of mouth and stopped talking to them.","","","","","","If they would have pestered me about it, I would have gotten annoyed.","If I would have talked about it, it probably wouldn’t have been an honest conversation and i’d still be in a toxic friendship.","","","","Wake up at 5, go to the gym at 5:30, eat food, get ready for class, eat again, sometimes go to work, do homework, nap, do more homework, shower, and sleep for the night.",5,5,9,9,NA,NA,NA,NA,NA,NA,1,4,4,1,2,1,2,3,1,1,4,1,1,1,1,1,1,1,1,1,"I feel fine.",1,2,3,"","female","19","black",2,"Haiti",2,2,2,3,0,1,0,0,2,"2",2,25,81,NA,NA,NA,12.5,40.5,NA,NA,NA,NA,NA,14,19
"One of my eyes was very inflamed and irritated (looked like I had mega pink eye), so much so that I had to miss class and an exam and go a week without contacts. I was basically blind. All's well that ends well though and I am now fine, seeing well and can wear my contacts.","","","","","","","","","","","I wake up at 10:30 as all my classes start at 11. I get dressed, make a cup of coffee, and go to class. I have a class or two depending on the day, lunch (normally benson), then one more class before my academic day is done. After 3:30 depending on the day I have either pre-wall street, DCCC, Dow Jones club, etc. The time until dinner is normally spent watching TV or Youtube, just being generally non-productive. After dinner I do whatever work and/or study I need to do and If I have time after I will do something with a friend or just relax for a bit before going to bed (by 2:00am every day ideally so I get 8 hours).",NA,NA,NA,NA,NA,NA,NA,NA,NA,NA,3,3,2,2,3,1,1,2,3,3,2,4,1,1,2,3,3,2,3,1,"It is resolved. I feel great about that. Only negative feelings now are toward exam week.",1,1,1,"No","Male","19","White",2,"United States",1,2,2,4,0,0,1,0,0,"3",0,NA,NA,NA,NA,NA,NA,NA,NA,NA,NA,NA,NA,28,17
"I was sexually assaulted at the beginning of this school year. As a result, I became extremely isolated and scared to leave my room, and my ""friends"" did absolutely nothing to reach out or help me. We haven't spoken in months, and it's infuriating that I wasted my time with people who cared so little about me. The outcome has left me without what I thought was my core group, and I've been spending a lot of time alone in my room because of it - still nervous to leave.","","","","","","If they had all chosen to continue going to DKE, where I was assaulted, I would be more frustrated. (one of them did choose to do this though)","If they had turned on me and thought I lied, I would be more frustrated.","If they had become friends with my assaulter, I would be more frustrated.","If I had confronted them about it, I would be more frustrated.","If they were actively mean to me, I would be more frustrated.","When I wake up, I usually shower, brush my teeth, and put on an outfit to go to class. I pack my bag and go to journalism at 9:30. I focus intently in this class and take notes and engage. Then I go straight to psychology at 11, where I take meticulous notes. After that, I go straight to Italian. I focus less here becuase I am so  I have a break in between Italian and my next course, and this is when I usually walk with my roommate to eat lunch. After this, I go straight to a practice room where I play piano and oboe. At 3:30, rehearsals start and I start with wind ensemble where we run through each of our pieces, and then orchestra immediately after where we",5,5,2,5,2,5,5,5,9,5,3,4,2,5,4,1,2,4,2,5,4,3,1,1,4,5,4,5,5,2,"I am even more upset about it having reflected upon it.",1,1,1,"","Female","20","White",2,"United States",2,2,1,1,0,1,0,0,5,"2",5,25,10,10,25,45,5,2,2,5,9,150,30,34,32
"Th situation resulted in a day of negative thoughts in terms of how my semester final grades would end up and how this would effect my future.","If I had studied more, then I would have received a better grade.","If I had better time managment, then I would have gotten a better grade.","If I got a better grade, then I could have a chance at my dream job.","","","","","","","","I usually get up at 10:00 for my 11 am class and then I have roughly four hours of class a day on average. In between classes I eat with my friends, and do homework. At night I usually do a lot of work till about 10 and then I go back to my dorm to either hang out with my gf or play some videogames by myself.",9,7,4,9,9,7,3,3,3,3,4,3,3,2,4,1,2,1,3,2,1,4,3,3,2,5,4,2,3,2,"I know it will work itself out but it can become hard to see past the tangible result",3,5,2,"","male","19","white",2,"US",2,2,2,4,1,0,0,3,0,"1",3,63,36,63,9,9,21,12,21,3,3,99,19.8,35,19
"The outcome of the situation is that this person probably has a temper and their rudeness also lost their friend","","","","","","if the person ignored the fight they would be friends until something worse happen","if the person started using physical violence they could have gotten arrested","if the person ignored the situation then they would keep getting into fights","","","when i wake up, i wash my face and brush my teeth and hair. i have a 9 am class so i get ready quickly and then go to class. after class i eat breakfast, get work done, and then go to the rest of my classes for the day. after class i do more work, go to the gym, eat dinner, spend time with friends, and then go to bed.",3,7,8,8,6,6,6,9,9,3,2,4,3,3,2,3,3,2,4,3,2,4,2,5,3,3,2,4,4,1,"i wrote about my schedule",1,1,1,"no","female","19","white",2,"america",1,2,2,5,0,1,0,0,2,"2",2,21,64,36,54,27,10.5,32,18,27,13.5,198,39.6,32,27
"A time I had a negative experience was last semester in my Spanish 212 class. I was feeling really anxious about being called on and not knowing the answer, because whenever I answered incorrectly, I would start to have a spiral of negative thoughts about myself. This culminated one day in me having to leave the room for a few minutes to calm myself down. This prompted me to go to the counseling center, which I still have regular visits with and has overall improved my quality of life.","","","","","","","","","","","I wake up everyday at 8am to take my allergy medication and brush my teeth. Then I get dressed and do my morning skincare routine, which consists of washing my face, toner, vitamin C serum, and SPF moisturizer. Then I use the Finch app to do some morning stretches. Then I eat breakfast, which is usually Greek yogurt with granola and chia seeds. After this, I usually have 15-30 minutes until my first class, so I will watch YouTube videos, scroll Instagram, or play games on my phone. My first class is at 9:30am for all days. After my first class, I go to the pit for an early lunch. I typically eat a wheat bagel with sun butter and jam, along with some fresh fruit. Then I will usually relax in my room until my next class, which is 12pm on Tuesdays and Thursdays and 1pm on Mondays, Wednesdays, and Fridays. This semester I only have two classes per day, so after my second class I will decompress in my room before going to whatever club meeting or event I have that day, as well as homework. I usually spend 30 minutes to 2 hours on homework every night, depending on which classes I have the next day and if I have any big projects going on.",NA,NA,NA,NA,NA,NA,NA,NA,NA,NA,4,1,1,1,2,2,1,1,2,3,1,2,1,1,1,2,3,2,2,1,"I feel that the outcome of starting therapy due to my Spanish class anxiety was an overall positive. I was planning on going to the counseling center eventually, but that was the catalyst, so even though it wasn't pleasant, I am grateful.",1,1,1,"","Cisgender woman","18","Asian (Chinese), white",2,"United States",1,2,2,1,0,0,1,0,0,"3",0,NA,NA,NA,NA,NA,NA,NA,NA,NA,NA,NA,NA,22,12
"Once a guy wanted to come on a weekend trip with my friend group and I, and I said to him we don't have room in the car maybe you can just get an uber. I felt really bad for a week after because I didn't like that I was the one to hint that we didn't want him to come. Now I feel it's really awkward between us and I feel like a bad person.
","If I hadn't said anything, then he wouldn't have felt discluded.","If I was around my friends who were encouraging me to say it, then I wouldn't have said anything.","If I had gotten more sleep, then I wouldn't have been as cranky.","","","","","","","","I wake up in the morning and get ready. Usually I will do my hair and pick out a nice outfit. I then make my way over to camino where I get coffee and do work with friends. We talk and do work at the same time. I head to classes and when I'm done I will go outside and do something active. I will either go on a walk in Reynolda or sit at a table or the fire pits and talk to friends. Later in the day I do work in the library. When it's time for dinner my friends and I go to the pit. After the pit I will continue with work or go to the gym. When the day is over I head back and shower and get ready for bed.",4,4,9,4,9,9,9,9,9,9,5,1,4,1,4,1,1,1,4,4,1,1,1,3,1,3,4,1,5,1,"Very bad.",7,7,7,"none","female","19","white",2,"united states",1,2,2,4,1,0,0,3,0,"1",3,16,36,81,81,81,5.33333333333333,12,27,27,27,405,81,37,10
"A week ago my girlfriend and I broke up. I ended up feeling extremely sad for a few days, unable to leave bed. Now I am doing a little bit better but still feel tired and drained all day.","","","","","","if we kept dating, we would get hurt worse in the future","if I didn't dump her, she would've dumped me eventually","if we kept dating, I would've stayed in a toxic relationship","if she broke up with me, I would be much more sad","if we stayed together, I would probably transfer colleges","I usually wake up about an hour before my first class of the day. After using my phone for a little bit, I go shower. I come back, brush my teeth, wash my face, and get dressed. I leave to go to class and attend all my classes for the day. Afterwards, I come back to the dorm and watch something on my computer until I fall asleep. I nap for a bit until I must wake up to do work. I either do work in the dorm or in the library until it is time to break my fast/eat dinner with my friends. After dinner, I do more work until I come back home and hangout with my friends. Eventually, I get ready for bed and go to sleep.",4,4,9,8,8,9,3,7,7,3,2,2,1,1,3,2,1,2,1,1,2,2,2,2,3,2,1,2,1,1,"Depressed",5,6,3,"","Male","18","Asian",2,"Bangladesh",1,2,1,4,0,1,0,0,5,"2",5,16,72,72,21,21,3.2,14.4,14.4,4.2,4.2,156,31.2,16,18
"when someone was lying about me to a friend to make them not like me. the outcome was that i was honest and my friend believed me","if the girl did not say anything to my friend, we would not have gotten in an argument","if she did not say anything, i would not have a big issue with her","","","","","","","","","i wake up, brush my teeth, wash my face, put my contacts in, go to the bathroom, do my hair, change, do my makeup, go to class, have lunch, talk to my friends in between classes, sit outside, after classes i hang out with my friends for a bit or watch some tv or go on my phone, do some homework, go to dinner, hang out with my friends, do homework, shower, text a friend, and go to sleep",2,6,1,1,NA,NA,NA,NA,NA,NA,1,2,1,1,1,1,1,1,1,1,1,5,1,1,4,1,3,2,2,1,"i feel good about it cause it worked out in my favor",2,1,1,"n/a","female","19","asian",2,"United States",1,2,2,2,1,0,0,2,0,"1",2,12,1,NA,NA,NA,6,0.5,NA,NA,NA,NA,NA,17,15
"","","","","","","","","","","","On a typical weekday, I wake up, take a shower, get dressed, brush my teeth, and go to class. Then, after class, I will",NA,NA,NA,NA,NA,NA,NA,NA,NA,NA,3,3,3,3,3,3,3,3,3,3,3,3,3,3,3,3,3,3,3,3,"",5,4,3,"","Male","19","White",2,"",1,2,1,2,0,1,0,0,0,"2",0,NA,NA,NA,NA,NA,NA,NA,NA,NA,NA,NA,NA,30,30
"I am a debate coach. There is another coach who seems to be very jealous of my success because my students consistently keep beating theirs. They consistently spread false rumors about me within online communities. I think it hurts my business because some of the people they have influence are deterred from hiring me. However, I believe in my own ability to coach and that I can get students regardless. I decided to just ignore them and be the bigger person.","","","","","","","","","","","I wake up at about 8:30 am and scroll youtube for 30 minutes then get coffee, study and then go to class. Then I get back and meander before eventually entering a productive state and try and get all my work out of the way. Then I eat my only meal of the day at around 4:30 and then go to the gym at 5:30. Then I finish any remaining work up until around 9 and then I play video games or hang out with friends until midnight and then go to sleep.",NA,NA,NA,NA,NA,NA,NA,NA,NA,NA,2,2,2,1,2,2,2,2,2,4,2,2,1,NA,3,3,1,4,3,1,"",1,1,1,"","Male","19","Asian",2,"United States",1,2,2,1,0,0,1,0,0,"3",0,NA,NA,NA,NA,NA,NA,NA,NA,NA,NA,NA,NA,NA,20
